DotNotation,StandardDescriptionCCSS.Math.Content.4.NF.B.3d,"Solve word problems involving addition and subtraction of fractions referring to the same whole and having like denominators, e.g., by using visual fraction models and equations to represent the problem."CCSS.Math.Content.4.NF.B.4,Apply and extend previous understandings of multiplication to multiply a fraction by a whole number.CCSS.Math.Content.4.NF.B.4a,Understand a fraction a/b as a multiple of 1/b.CCSS.Math.Content.4.NF.B.4b,"Understand a multiple of a/b as a multiple of 1/b, and use this understanding to multiply a fraction by a whole number."CCSS.Math.Content.4.NF.B.4c,"Solve word problems involving multiplication of a fraction by a whole number, e.g., by using visual fraction models and equations to represent the problem."CCSS.Math.Content.4.NF.C,"Understand decimal notation for fractions, and compare decimal fractions."CCSS.Math.Content.4.NF.C.5,"Express a fraction with denominator 10 as an equivalent fraction with denominator 100, and use this technique to add two fractions with respective denominators 10 and 100."CCSS.Math.Content.4.NF.C.6,Use decimal notation for fractions with denominators 10 or 100.CCSS.Math.Content.4.NF.C.7,"Compare two decimals to hundredths by reasoning about their size. Recognize that comparisons are valid only when the two decimals refer to the same whole. Record the results of comparisons with the symbols &gt;, =, or &lt;, and justify the conclusions, e."CCSS.Math.Content.4.OA.A,Use the four operations with whole numbers to solve problems.CCSS.Math.Content.4.OA.A.1,"Interpret a multiplication equation as a comparison, e.g., interpret 35 = 5 ?? 7 as a statement that 35 is 5 times as many as 7 and 7 times as many as 5. Represent verbal statements of multiplicative comparisons as multiplication equations."CCSS.Math.Content.4.OA.A.2,"Multiply or divide to solve word problems involving multiplicative comparison, e.g., by using drawings and equations with a symbol for the unknown number to represent the problem, distinguishing multiplicative comparison from additive comparison."CCSS.Math.Content.4.OA.A.3,"Solve multistep word problems posed with whole numbers and having whole-number answers using the four operations, including problems in which remainders must be interpreted. Represent these problems using equations with a letter standing for the unknown q"CCSS.Math.Content.4.OA.B,Gain familiarity with factors and multiples.CCSS.Math.Content.4.OA.B.4,Find all factor pairs for a whole number in the range 1???100. Recognize that a whole number is a multiple of each of its factors. Determine whether a given whole number in the range 1???100 is a multiple of a given one-digit number. Determine whether a gCCSS.Math.Content.4.OA.C,Generate and analyze patterns.CCSS.Math.Content.4.OA.C.5,Generate a number or shape pattern that follows a given rule. Identify apparent features of the pattern that were not explicit in the rule itself.CCSS.Math.Content.5.G.A,Graph points on the coordinate plane to solve real-world and mathematical problems.CCSS.Math.Content.5.G.A.1,"Use a pair of perpendicular number lines, called axes, to define a coordinate system, with the intersection of the lines (the origin) arranged to coincide with the 0 on each line and a given point in the plane located by using an ordered pair of numbers, "CCSS.Math.Content.5.G.A.2,"Represent real world and mathematical problems by graphing points in the first quadrant of the coordinate plane, and interpret coordinate values of points in the context of the situation."CCSS.Math.Content.5.G.B,Classify two-dimensional figures into categories based on their properties.CCSS.Math.Content.5.G.B.3,Understand that attributes belonging to a category of two-dimensional figures also belong to all subcategories of that category.CCSS.Math.Content.5.G.B.4,Classify two-dimensional figures in a hierarchy based on properties.CCSS.Math.Content.5.MD.A,Convert like measurement units within a given measurement system.CCSS.Math.Content.5.MD.A.1,"Convert among different-sized standard measurement units within a given measurement system (e.g., convert 5 cm to 0.05 m), and use these conversions in solving multi-step, real world problems."CCSS.Math.Content.5.MD.B.2,Represent and interpret data.CCSS.Math.Content.5.MD.B.2,"Make a line plot to display a data set of measurements in fractions of a unit (1/2, 1/4, 1/8). Use operations on fractions for this grade to solve problems involving information presented in line plots."CCSS.Math.Content.5.MD.C,Geometric measurement: understand concepts of volume and relate volume to multiplication and to addition.CCSS.Math.Content.5.MD.C.3,Recognize volume as an attribute of solid figures and understand concepts of volume measurement.CCSS.Math.Content.5.MD.C.3a,"A cube with side length 1 unit, called a ""unit cube,"" is said to have ""one cubic unit"" of volume, and can be used to measure volume."CCSS.Math.Content.5.MD.C.3b,A solid figure which can be packed without gaps or overlaps using n unit cubes is said to have a volume of n cubic units.CCSS.Math.Content.5.MD.C.4,"Measure volumes by counting unit cubes, using cubic cm, cubic in, cubic ft, and improvised units."CCSS.Math.Content.5.MD.C.5,Relate volume to the operations of multiplication and addition and solve real world and mathematical problems involving volume.CCSS.Math.Content.5.MD.C.5a,"Find the volume of a right rectangular prism with whole-number side lengths by packing it with unit cubes, and show that the volume is the same as would be found by multiplying the edge lengths, equivalently by multiplying the height by the area of the ba"CCSS.Math.Content.5.MD.C.5b,Apply the formulas V = l ?? w ?? h and V = b ?? h for rectangular prisms to find volumes of right rectangular prisms with whole-number edge lengths in the context of solving real world and mathematical problems.CCSS.Math.Content.5.MD.C.5c,"Recognize volume as additive. Find volumes of solid figures composed of two non-overlapping right rectangular prisms by adding the volumes of the non-overlapping parts, applying this technique to solve real world problems."CCSS.Math.Content.5.NBT.A,Understand the place value system.CCSS.Math.Content.5.NBT.A.1,"Recognize that in a multi-digit number, a digit in one place represents 10 times as much as it represents in the place to its right and 1/10 of what it represents in the place to its left."CCSS.Math.Content.5.NBT.A.2,"Explain patterns in the number of zeros of the product when multiplying a number by powers of 10, and explain patterns in the placement of the decimal point when a decimal is multiplied or divided by a power of 10. Use whole-number exponents to denote pow"CCSS.Math.Content.5.NBT.A.3,"Read, write, and compare decimals to thousandths."CCSS.Math.Content.5.NBT.A.3a,"Read and write decimals to thousandths using base-ten numerals, number names, and expanded form, e.g., 347.392 = 3 ?? 100 + 4 ?? 10 + 7 ?? 1 + 3 ?? (1/10) + 9 ?? (1/100) + 2 ?? (1/1000)."CCSS.Math.Content.5.NBT.A.3b,"Compare two decimals to thousandths based on meanings of the digits in each place, using &gt;, =, and &lt; symbols to record the results of comparisons."CCSS.Math.Content.5.NBT.A.4,Use place value understanding to round decimals to any place.CCSS.Math.Content.5.NBT.B,Perform operations with multi-digit whole numbers and with decimals to hundredths.CCSS.Math.Content.5.NBT.B.5,Fluently multiply multi-digit whole numbers using the standard algorithm.CCSS.Math.Content.5.NBT.B.6,"Find whole-number quotients of whole numbers with up to four-digit dividends and two-digit divisors, using strategies based on place value, the properties of operations, and/or the relationship between multiplication and division. Illustrate and explain t"CCSS.Math.Content.5.NBT.B.7,"Add, subtract, multiply, and divide decimals to hundredths, using concrete models or drawings and strategies based on place value, properties of operations, and/or the relationship between addition and subtraction; relate the strategy to a written method "CCSS.Math.Content.5.NF.A,Use equivalent fractions as a strategy to add and subtract fractions.CCSS.Math.Content.5.NF.A.1,Add and subtract fractions with unlike denominators (including mixed numbers) by replacing given fractions with equivalent fractions in such a way as to produce an equivalent sum or difference of fractions with like denominators.CCSS.Math.Content.5.NF.A.2,"Solve word problems involving addition and subtraction of fractions referring to the same whole, including cases of unlike denominators, e.g., by using visual fraction models or equations to represent the problem. Use benchmark fractions and number sense "CCSS.Math.Content.5.NF.B,Apply and extend previous understandings of multiplication and division to multiply and divide fractions.CCSS.Math.Content.5.NF.B.3,"Interpret a fraction as division of the numerator by the denominator (a/b = a ?? b). Solve word problems involving division of whole numbers leading to answers in the form of fractions or mixed numbers, e.g., by using visual fraction models or equations t"CCSS.Math.Content.5.NF.B.4,Apply and extend previous understandings of multiplication to multiply a fraction or whole number by a fraction.CCSS.Math.Content.5.NF.B.4a,"Interpret the product (a/b) ?? q as a parts of a partition of q into b equal parts; equivalently, as the result of a sequence of operations a ?? q ?? b."CCSS.Math.Content.5.NF.B.4b,"Find the area of a rectangle with fractional side lengths by tiling it with unit squares of the appropriate unit fraction side lengths, and show that the area is the same as would be found by multiplying the side lengths. Multiply fractional side lengths "CCSS.Math.Content.5.NF.B.5,"Interpret multiplication as scaling (resizing), by:"CCSS.Math.Content.5.NF.B.5a,"Comparing the size of a product to the size of one factor on the basis of the size of the other factor, without performing the indicated multiplication."CCSS.Math.Content.5.NF.B.5b,Explaining why multiplying a given number by a fraction greater than 1 results in a product greater than the given number (recognizing multiplication by whole numbers greater than 1 as a familiar case); explaining why multiplying a given number by a fractCCSS.Math.Content.5.NF.B.6,"Solve real world problems involving multiplication of fractions and mixed numbers, e.g., by using visual fraction models or equations to represent the problem."CCSS.Math.Content.5.NF.B.7,Apply and extend previous understandings of division to divide unit fractions by whole numbers and whole numbers by unit fractions.CCSS.Math.Content.5.NF.B.7a,"Interpret division of a unit fraction by a non-zero whole number, and compute such quotients."CCSS.Math.Content.5.NF.B.7b,"Interpret division of a whole number by a unit fraction, and compute such quotients."CCSS.Math.Content.5.NF.B.7c,"Solve real world problems involving division of unit fractions by non-zero whole numbers and division of whole numbers by unit fractions, e.g., by using visual fraction models and equations to represent the problem."CCSS.Math.Content.5.OA.A,Write and interpret numerical expressions.CCSS.Math.Content.5.OA.A.1,"Use parentheses, brackets, or braces in numerical expressions, and evaluate expressions with these symbols."CCSS.Math.Content.5.OA.A.2,"Write simple expressions that record calculations with numbers, and interpret numerical expressions without evaluating them."CCSS.Math.Content.5.OA.B,Analyze patterns and relationships.CCSS.Math.Content.5.OA.B.3,"Generate two numerical patterns using two given rules. Identify apparent relationships between corresponding terms. Form ordered pairs consisting of corresponding terms from the two patterns, and graph the ordered pairs on a coordinate plane."CCSS.Math.Content.6.EE.A,Apply and extend previous understandings of arithmetic to algebraic expressions.CCSS.Math.Content.6.EE.A.1,Write and evaluate numerical expressions involving whole-number exponents.CCSS.Math.Content.6.EE.A.2,"Write, read, and evaluate expressions in which letters stand for numbers."CCSS.Math.Content.6.EE.A.2a,Write expressions that record operations with numbers and with letters standing for numbers.CCSS.Math.Content.6.EE.A.2b,"Identify parts of an expression using mathematical terms (sum, term, product, factor, quotient, coefficient); view one or more parts of an expression as a single entity."CCSS.Math.Content.6.EE.A.2c,"Evaluate expressions at specific values of their variables. Include expressions that arise from formulas used in real-world problems. Perform arithmetic operations, including those involving whole-number exponents, in the conventional order when there are"CCSS.Math.Content.6.EE.A.3,Apply the properties of operations to generate equivalent expressions.CCSS.Math.Content.6.EE.A.4,"Identify when two expressions are equivalent (i.e., when the two expressions name the same number regardless of which value is substituted into them)."CCSS.Math.Content.6.EE.B,Reason about and solve one-variable equations and inequalities.CCSS.Math.Content.6.EE.B.5,"Understand solving an equation or inequality as a process of answering a question: which values from a specified set, if any, make the equation or inequality true? Use substitution to determine whether a given number in a specified set makes an equation o"CCSS.Math.Content.6.EE.B.6,"Use variables to represent numbers and write expressions when solving a real-world or mathematical problem; understand that a variable can represent an unknown number, or, depending on the purpose at hand, any number in a specified set."CCSS.Math.Content.6.EE.B.7,"Solve real-world and mathematical problems by writing and solving equations of the form x + p = q and px = q for cases in which p, q and x are all nonnegative rational numbers."CCSS.Math.Content.6.EE.B.8,Write an inequality of the form x &gt; c or x &lt; c to represent a constraint or condition in a real-world or mathematical problem. Recognize that inequalities of the form x &gt; c or x &lt; c have infinitely many solutions; represent solutions of such iCCSS.Math.Content.6.EE.C,Represent and analyze quantitative relationships between dependent and independent variables.CCSS.Math.Content.6.EE.C.9,"Use variables to represent two quantities in a real-world problem that change in relationship to one another; write an equation to express one quantity, thought of as the dependent variable, in terms of the other quantity, thought of as the independent va"CCSS.Math.Content.6.G.A,"Solve real-world and mathematical problems involving area, surface area, and volume."CCSS.Math.Content.6.G.A.1,"Find the area of right triangles, other triangles, special quadrilaterals, and polygons by composing into rectangles or decomposing into triangles and other shapes; apply these techniques in the context of solving real-world and mathematical problems."CCSS.Math.Content.6.G.A.2,"Find the volume of a right rectangular prism with fractional edge lengths by packing it with unit cubes of the appropriate unit fraction edge lengths, and show that the volume is the same as would be found by multiplying the edge lengths of the prism. App"CCSS.Math.Content.6.G.A.3,Draw polygons in the coordinate plane given coordinates for the vertices; use coordinates to find the length of a side joining points with the same first coordinate or the same second coordinate. Apply these techniques in the context of solving real-worldCCSS.Math.Content.6.G.A.4,"Represent three-dimensional figures using nets made up of rectangles and triangles, and use the nets to find the surface area of these figures. Apply these techniques in the context of solving real-world and mathematical problems."CCSS.Math.Content.6.NS.A,Apply and extend previous understandings of multiplication and division to divide fractions by fractions.CCSS.Math.Content.6.NS.A.1,"Interpret and compute quotients of fractions, and solve word problems involving division of fractions by fractions, e.g., by using visual fraction models and equations to represent the problem."CCSS.Math.Content.6.NS.B,Compute fluently with multi-digit numbers and find common factors and multiples.CCSS.Math.Content.6.NS.B.2,Fluently divide multi-digit numbers using the standard algorithm.CCSS.Math.Content.6.NS.B.3,"Fluently add, subtract, multiply, and divide multi-digit decimals using the standard algorithm for each operation."CCSS.Math.Content.6.NS.B.4,Find the greatest common factor of two whole numbers less than or equal to 100 and the least common multiple of two whole numbers less than or equal to 12. Use the distributive property to express a sum of two whole numbers 1???100 with a common factor asCCSS.Math.Content.6.NS.C,Apply and extend previous understandings of numbers to the system of rational numbers.CCSS.Math.Content.6.NS.C.5,"Understand that positive and negative numbers are used together to describe quantities having opposite directions or values (e.g., temperature above/below zero, elevation above/below sea level, credits/debits, positive/negative electric charge); use posit"CCSS.Math.Content.6.NS.C.6,Understand a rational number as a point on the number line. Extend number line diagrams and coordinate axes familiar from previous grades to represent points on the line and in the plane with negative number coordinates.CCSS.Math.Content.6.NS.C.6a,"Recognize opposite signs of numbers as indicating locations on opposite sides of 0 on the number line; recognize that the opposite of the opposite of a number is the number itself, e.g., -(-3) = 3, and that 0 is its own opposite."CCSS.Math.Content.6.NS.C.6b,"Understand signs of numbers in ordered pairs as indicating locations in quadrants of the coordinate plane; recognize that when two ordered pairs differ only by signs, the locations of the points are related by reflections across one or both axes."CCSS.Math.Content.6.NS.C.6c,Find and position integers and other rational numbers on a horizontal or vertical number line diagram; find and position pairs of integers and other rational numbers on a coordinate plane.CCSS.Math.Content.6.NS.C.7,Understand ordering and absolute value of rational numbers.CCSS.Math.Content.6.NS.C.7a,Interpret statements of inequality as statements about the relative position of two numbers on a number line diagram.CCSS.Math.Content.6.NS.C.7b,"Write, interpret, and explain statements of order for rational numbers in real-world contexts."CCSS.Math.Content.6.NS.C.7c,Understand the absolute value of a rational number as its distance from 0 on the number line; interpret absolute value as magnitude for a positive or negative quantity in a real-world situation.CCSS.Math.Content.6.NS.C.7d,Distinguish comparisons of absolute value from statements about order.CCSS.Math.Content.6.NS.C.8,Solve real-world and mathematical problems by graphing points in all four quadrants of the coordinate plane. Include use of coordinates and absolute value to find distances between points with the same first coordinate or the same second coordinate.CCSS.Math.Content.6.RP.A,Understand ratio concepts and use ratio reasoning to solve problems.CCSS.Math.Content.6.RP.A.1,Understand the concept of a ratio and use ratio language to describe a ratio relationship between two quantities.CCSS.Math.Content.6.RP.A.2,"Understand the concept of a unit rate a/b associated with a ratio a:b with b ??? 0, and use rate language in the context of a ratio relationship."CCSS.Math.Content.6.RP.A.3,"Use ratio and rate reasoning to solve real-world and mathematical problems, e.g., by reasoning about tables of equivalent ratios, tape diagrams, double number line diagrams, or equations."CCSS.Math.Content.6.RP.A.3a,"Make tables of equivalent ratios relating quantities with whole number measurements, find missing values in the tables, and plot the pairs of values on the coordinate plane. Use tables to compare ratios."CCSS.Math.Content.6.RP.A.3b,Solve unit rate problems including those involving unit pricing and constant speed.CCSS.Math.Content.6.RP.A.3c,"Find a percent of a quantity as a rate per 100 (e.g., 30% of a quantity means 30/100 times the quantity); solve problems involving finding the whole, given a part and the percent."CCSS.Math.Content.6.RP.A.3d,Use ratio reasoning to convert measurement units; manipulate and transform units appropriately when multiplying or dividing quantities.CCSS.Math.Content.6.SP.A,Develop understanding of statistical variability.CCSS.Math.Content.6.SP.A.1,Recognize a statistical question as one that anticipates variability in the data related to the question and accounts for it in the answers.CCSS.Math.Content.6.SP.A.2,"Understand that a set of data collected to answer a statistical question has a distribution which can be described by its center, spread, and overall shape."CCSS.Math.Content.6.SP.A.3,"Recognize that a measure of center for a numerical data set summarizes all of its values with a single number, while a measure of variation describes how its values vary with a single number."CCSS.Math.Content.6.SP.B,Summarize and describe distributions.CCSS.Math.Content.6.SP.B.4,"Display numerical data in plots on a number line, including dot plots, histograms, and box plots."CCSS.Math.Content.6.SP.B.5,"Summarize numerical data sets in relation to their context, such as by:"CCSS.Math.Content.6.SP.B.5a,Reporting the number of observations.CCSS.Math.Content.6.SP.B.5b,"Describing the nature of the attribute under investigation, including how it was measured and its units of measurement."CCSS.Math.Content.6.SP.B.5c,"Giving quantitative measures of center (median and/or mean) and variability (interquartile range and/or mean absolute deviation), as well as describing any overall pattern and any striking deviations from the overall pattern with reference to the context "CCSS.Math.Content.6.SP.B.5d,Relating the choice of measures of center and variability to the shape of the data distribution and the context in which the data were gathered.CCSS.Math.Content.7.EE.A,Use properties of operations to generate equivalent expressions.CCSS.Math.Content.7.EE.A.1,"Apply properties of operations as strategies to add, subtract, factor, and expand linear expressions with rational coefficients."CCSS.Math.Content.7.EE.A.2,Understand that rewriting an expression in different forms in a problem context can shed light on the problem and how the quantities in it are related.CCSS.Math.Content.7.EE.B,Solve real-life and mathematical problems using numerical and algebraic expressions and equations.CCSS.Math.Content.7.EE.B.3,"Solve multi-step real-life and mathematical problems posed with positive and negative rational numbers in any form (whole numbers, fractions, and decimals), using tools strategically. Apply properties of operations to calculate with numbers in any form; c"CCSS.Math.Content.7.EE.B.4,"Use variables to represent quantities in a real-world or mathematical problem, and construct simple equations and inequalities to solve problems by reasoning about the quantities."CCSS.Math.Content.7.EE.B.4a,"Solve word problems leading to equations of the form px + q = r and p(x + q) = r, where p, q, and r are specific rational numbers. Solve equations of these forms fluently. Compare an algebraic solution to an arithmetic solution, identifying the sequence o"CCSS.Math.Content.7.EE.B.4b,"Solve word problems leading to inequalities of the form px + q &gt; r or px + q &lt; r, where p, q, and r are specific rational numbers. Graph the solution set of the inequality and interpret it in the context of the problem."CCSS.Math.Content.7.G.A,"Draw, construct, and describe geometrical figures and describe the relationships between them."CCSS.Math.Content.7.G.A.1,"Solve problems involving scale drawings of geometric figures, including computing actual lengths and areas from a scale drawing and reproducing a scale drawing at a different scale."CCSS.Math.Content.7.G.A.2,"Draw (freehand, with ruler and protractor, and with technology) geometric shapes with given conditions. Focus on constructing triangles from three measures of angles or sides, noticing when the conditions determine a unique triangle, more than one triangl"CCSS.Math.Content.7.G.A.3,"Describe the two-dimensional figures that result from slicing three-dimensional figures, as in plane sections of right rectangular prisms and right rectangular pyramids."CCSS.Math.Content.7.G.B,"Solve real-life and mathematical problems involving angle measure, area, surface area, and volume."CCSS.Math.Content.7.G.B.4,Know the formulas for the area and circumference of a circle and use them to solve problems; give an informal derivation of the relationship between the circumference and area of a circle.CCSS.Math.Content.7.G.B.5,"Use facts about supplementary, complementary, vertical, and adjacent angles in a multi-step problem to write and solve simple equations for an unknown angle in a figure."CCSS.Math.Content.7.G.B.6,"Solve real-world and mathematical problems involving area, volume and surface area of two- and three-dimensional objects composed of triangles, quadrilaterals, polygons, cubes, and right prisms."CCSS.Math.Content.7.NS.A,"Apply and extend previous understandings of operations with fractions to add, subtract, multiply, and divide rational numbers."CCSS.Math.Content.7.NS.A.1,Apply and extend previous understandings of addition and subtraction to add and subtract rational numbers; represent addition and subtraction on a horizontal or vertical number line diagram.CCSS.Math.Content.7.NS.A.1a,Describe situations in which opposite quantities combine to make 0.CCSS.Math.Content.7.NS.A.1b,"Understand p + q as the number located a distance q from p, in the positive or negative direction depending on whether q is positive or negative. Show that a number and its opposite have a sum of 0 (are additive inverses). Interpret sums of rational numbe"