DotNotation,StandardDescriptionCCSS.Math.Content.1.G.A,Reason with shapes and their attributes.CCSS.Math.Content.1.G.A.1,"Distinguish between defining attributes (e.g., triangles are closed and three-sided) versus non-defining attributes (e.g., color, orientation, overall size); build and draw shapes to possess defining attributes."CCSS.Math.Content.1.G.A.2,"Compose two-dimensional shapes (rectangles, squares, trapezoids, triangles, half-circles, and quarter-circles) or three-dimensional shapes (cubes, right rectangular prisms, right circular cones, and right circular cylinders) to create a composite shape, a"CCSS.Math.Content.1.G.A.3,"Partition circles and rectangles into two and four equal shares, describe the shares using the words halves, fourths, and quarters, and use the phrases half of, fourth of, and quarter of. Describe the whole as two of, or four of the shares. Understand for"CCSS.Math.Content.1.MD.A,Measure lengths indirectly and by iterating length units.CCSS.Math.Content.1.MD.A.1,Order three objects by length; compare the lengths of two objects indirectly by using a third object.CCSS.Math.Content.1.MD.A.2,"Express the length of an object as a whole number of length units, by laying multiple copies of a shorter object (the length unit) end to end; understand that the length measurement of an object is the number of same-size length units that span it with no"CCSS.Math.Content.1.MD.B,Tell and write time.CCSS.Math.Content.1.MD.B.3,Tell and write time in hours and half-hours using analog and digital clocks.CCSS.Math.Content.1.MD.C,Represent and interpret data.CCSS.Math.Content.1.MD.C.4,"Organize, represent, and interpret data with up to three categories; ask and answer questions about the total number of data points, how many in each category, and how many more or less are in one category than in another."CCSS.Math.Content.1.NBT.A,Extend the counting sequence.CCSS.Math.Content.1.NBT.A.1,"Count to 120, starting at any number less than 120. In this range, read and write numerals and represent a number of objects with a written numeral."CCSS.Math.Content.1.NBT.B,Understand place value.CCSS.Math.Content.1.NBT.B.2,Understand that the two digits of a two-digit number represent amounts of tens and ones. Understand the following as special cases:CCSS.Math.Content.1.NBT.B.2a,"10 can be thought of as a bundle of ten ones ??? called a ""ten."""CCSS.Math.Content.1.NBT.B.2b,"The numbers from 11 to 19 are composed of a ten and one, two, three, four, five, six, seven, eight, or nine ones."CCSS.Math.Content.1.NBT.B.2c,"The numbers 10, 20, 30, 40, 50, 60, 70, 80, 90 refer to one, two, three, four, five, six, seven, eight, or nine tens (and 0 ones)."CCSS.Math.Content.1.NBT.B.3,"Compare two two-digit numbers based on meanings of the tens and ones digits, recording the results of comparisons with the symbols &gt;, =, and &lt;."CCSS.Math.Content.1.NBT.C,Use place value understanding and properties of operations to add and subtract.CCSS.Math.Content.1.NBT.C.4,"Add within 100, including adding a two-digit number and a one-digit number, and adding a two-digit number and a multiple of 10, using concrete models or drawings and strategies based on place value, properties of operations, and/or the relationship betwee"CCSS.Math.Content.1.NBT.C.5,"Given a two-digit number, mentally find 10 more or 10 less than the number, without having to count; explain the reasoning used."CCSS.Math.Content.1.NBT.C.6,"Subtract multiples of 10 in the range 10-90 from multiples of 10 in the range 10-90 (positive or zero differences), using concrete models or drawings and strategies based on place value, properties of operations, and/or the relationship between addition a"CCSS.Math.Content.1.OA.A,Represent and solve problems involving addition and subtraction.CCSS.Math.Content.1.OA.A.1,"Use addition and subtraction within 20 to solve word problems involving situations of adding to, taking from, putting together, taking apart, and comparing, with unknowns in all positions, e.g., by using objects, drawings, and equations with a symbol for "CCSS.Math.Content.1.OA.A.2,"Solve word problems that call for addition of three whole numbers whose sum is less than or equal to 20, e.g., by using objects, drawings, and equations with a symbol for the unknown number to represent the problem."CCSS.Math.Content.1.OA.B,Understand and apply properties of operations and the relationship between addition and subtraction.CCSS.Math.Content.1.OA.B.3,Apply properties of operations as strategies to add and subtract.CCSS.Math.Content.1.OA.B.4,Understand subtraction as an unknown-addend problem.CCSS.Math.Content.1.OA.C,Add and subtract within 20.CCSS.Math.Content.1.OA.C.5,"Relate counting to addition and subtraction (e.g., by counting on 2 to add 2)."CCSS.Math.Content.1.OA.C.6,"Add and subtract within 20, demonstrating fluency for addition and subtraction within 10. Use strategies such as counting on; making ten (e.g., 8 + 6 = 8 + 2 + 4 = 10 + 4 = 14); decomposing a number leading to a ten (e.g., 13 - 4 = 13 - 3 - 1 = 10 - 1 = 9"CCSS.Math.Content.1.OA.D,Work with addition and subtraction equations.CCSS.Math.Content.1.OA.D.7,"Understand the meaning of the equal sign, and determine if equations involving addition and subtraction are true or false."CCSS.Math.Content.1.OA.D.8,Determine the unknown whole number in an addition or subtraction equation relating three whole numbers.CCSS.Math.Content.2.G.A,Reason with shapes and their attributes.CCSS.Math.Content.2.G.A.1,"Recognize and draw shapes having specified attributes, such as a given number of angles or a given number of equal faces. Identify triangles, quadrilaterals, pentagons, hexagons, and cubes."CCSS.Math.Content.2.G.A.2,Partition a rectangle into rows and columns of same-size squares and count to find the total number of them.CCSS.Math.Content.2.G.A.3,"Partition circles and rectangles into two, three, or four equal shares, describe the shares using the words halves, thirds, half of, a third of, etc., and describe the whole as two halves, three thirds, four fourths. Recognize that equal shares of identic"CCSS.Math.Content.2.MD.A,Measure and estimate lengths in standard units.CCSS.Math.Content.2.MD.A.1,"Measure the length of an object by selecting and using appropriate tools such as rulers, yardsticks, meter sticks, and measuring tapes."CCSS.Math.Content.2.MD.A.2,"Measure the length of an object twice, using length units of different lengths for the two measurements; describe how the two measurements relate to the size of the unit chosen."CCSS.Math.Content.2.MD.A.3,"Estimate lengths using units of inches, feet, centimeters, and meters."CCSS.Math.Content.2.MD.A.4,"Measure to determine how much longer one object is than another, expressing the length difference in terms of a standard length unit."CCSS.Math.Content.2.MD.B,Relate addition and subtraction to length.CCSS.Math.Content.2.MD.B.5,"Use addition and subtraction within 100 to solve word problems involving lengths that are given in the same units, e.g., by using drawings (such as drawings of rulers) and equations with a symbol for the unknown number to represent the problem."CCSS.Math.Content.2.MD.B.6,"Represent whole numbers as lengths from 0 on a number line diagram with equally spaced points corresponding to the numbers 0, 1, 2, ..., and represent whole-number sums and differences within 100 on a number line diagram."CCSS.Math.Content.2.MD.C,Work with time and money.CCSS.Math.Content.2.MD.C.7,"Tell and write time from analog and digital clocks to the nearest five minutes, using a.m. and p.m."CCSS.Math.Content.2.MD.C.8,"Solve word problems involving dollar bills, quarters, dimes, nickels, and pennies, using $ and ?? symbols appropriately."CCSS.Math.Content.2.MD.D,Represent and interpret data.CCSS.Math.Content.2.MD.D.10,"Draw a picture graph and a bar graph (with single-unit scale) to represent a data set with up to four categories. Solve simple put-together, take-apart, and compare problems using information presented in a bar graph."CCSS.Math.Content.2.MD.D.9,"Generate measurement data by measuring lengths of several objects to the nearest whole unit, or by making repeated measurements of the same object. Show the measurements by making a line plot, where the horizontal scale is marked off in whole-number units"CCSS.Math.Content.2.NBT.A,Understand place value.CCSS.Math.Content.2.NBT.A.1,"Understand that the three digits of a three-digit number represent amounts of hundreds, tens, and ones; e.g., 706 equals 7 hundreds, 0 tens, and 6 ones. Understand the following as special cases:"CCSS.Math.Content.2.NBT.A.1a,"100 can be thought of as a bundle of ten tens ??? called a ""hundred."""CCSS.Math.Content.2.NBT.A.1b,"The numbers 100, 200, 300, 400, 500, 600, 700, 800, 900 refer to one, two, three, four, five, six, seven, eight, or nine hundreds (and 0 tens and 0 ones)."CCSS.Math.Content.2.NBT.A.2,"Count within 1000; skip-count by 5s, 10s, and 100s."CCSS.Math.Content.2.NBT.A.3,"Read and write numbers to 1000 using base-ten numerals, number names, and expanded form."CCSS.Math.Content.2.NBT.A.4,"Compare two three-digit numbers based on meanings of the hundreds, tens, and ones digits, using &gt;, =, and &lt; symbols to record the results of comparisons."CCSS.Math.Content.2.NBT.B,Use place value understanding and properties of operations to add and subtract.CCSS.Math.Content.2.NBT.B.5,"Fluently add and subtract within 100 using strategies based on place value, properties of operations, and/or the relationship between addition and subtraction."CCSS.Math.Content.2.NBT.B.6,Add up to four two-digit numbers using strategies based on place value and properties of operations.CCSS.Math.Content.2.NBT.B.7,"Add and subtract within 1000, using concrete models or drawings and strategies based on place value, properties of operations, and/or the relationship between addition and subtraction; relate the strategy to a written method. Understand that in adding or "CCSS.Math.Content.2.NBT.B.8,"Mentally add 10 or 100 to a given number 100???900, and mentally subtract 10 or 100 from a given number 100???900."CCSS.Math.Content.2.NBT.B.9,"Explain why addition and subtraction strategies work, using place value and the properties of operations."CCSS.Math.Content.2.OA.A,Represent and solve problems involving addition and subtraction.CCSS.Math.Content.2.OA.A.1,"Use addition and subtraction within 100 to solve one- and two-step word problems involving situations of adding to, taking from, putting together, taking apart, and comparing, with unknowns in all positions, e.g., by using drawings and equations with a sy"CCSS.Math.Content.2.OA.B,Add and subtract within 20.CCSS.Math.Content.2.OA.B.2,"Fluently add and subtract within 20 using mental strategies. By end of Grade 2, know from memory all sums of two one-digit numbers."CCSS.Math.Content.2.OA.C,Work with equal groups of objects to gain foundations for multiplication.CCSS.Math.Content.2.OA.C.3,"Determine whether a group of objects (up to 20) has an odd or even number of members, e.g., by pairing objects or counting them by 2s; write an equation to express an even number as a sum of two equal addends."CCSS.Math.Content.2.OA.C.4,Use addition to find the total number of objects arranged in rectangular arrays with up to 5 rows and up to 5 columns; write an equation to express the total as a sum of equal addends.CCSS.Math.Content.3.G.A,Reason with shapes and their attributes.CCSS.Math.Content.3.G.A.1,"Understand that shapes in different categories (e.g., rhombuses, rectangles, and others) may share attributes (e.g., having four sides), and that the shared attributes can define a larger category (e.g., quadrilaterals). Recognize rhombuses, rectangles, a"CCSS.Math.Content.3.G.A.2,Partition shapes into parts with equal areas. Express the area of each part as a unit fraction of the whole.CCSS.Math.Content.3.MD.A,"Solve problems involving measurement and estimation of intervals of time, liquid volumes, and masses of objects."CCSS.Math.Content.3.MD.A.1,"Tell and write time to the nearest minute and measure time intervals in minutes. Solve word problems involving addition and subtraction of time intervals in minutes, e.g., by representing the problem on a number line diagram."CCSS.Math.Content.3.MD.A.2,"Measure and estimate liquid volumes and masses of objects using standard units of grams (g), kilograms (kg), and liters (l). Add, subtract, multiply, or divide to solve one-step word problems involving masses or volumes that are given in the same units, e"CCSS.Math.Content.3.MD.B,Represent and interpret data.CCSS.Math.Content.3.MD.B.3,"Draw a scaled picture graph and a scaled bar graph to represent a data set with several categories. Solve one- and two-step ""how many more"" and ""how many less"" problems using information presented in scaled bar graphs."CCSS.Math.Content.3.MD.B.4,"Generate measurement data by measuring lengths using rulers marked with halves and fourths of an inch. Show the data by making a line plot, where the horizontal scale is marked off in appropriate units??? whole numbers, halves, or quarters."CCSS.Math.Content.3.MD.C,Geometric measurement: understand concepts of area and relate area to multiplication and to addition.CCSS.Math.Content.3.MD.C.5,Recognize area as an attribute of plane figures and understand concepts of area measurement.CCSS.Math.Content.3.MD.C.5a,"A square with side length 1 unit, called ""a unit square,"" is said to have ""one square unit"" of area, and can be used to measure area."CCSS.Math.Content.3.MD.C.5b,A plane figure which can be covered without gaps or overlaps by n unit squares is said to have an area of n square units.CCSS.Math.Content.3.MD.C.6,"Measure areas by counting unit squares (square cm, square m, square in, square ft, and improvised units)."CCSS.Math.Content.3.MD.C.7,Relate area to the operations of multiplication and addition.CCSS.Math.Content.3.MD.C.7a,"Find the area of a rectangle with whole-number side lengths by tiling it, and show that the area is the same as would be found by multiplying the side lengths."CCSS.Math.Content.3.MD.C.7b,"Multiply side lengths to find areas of rectangles with whole-number side lengths in the context of solving real world and mathematical problems, and represent whole-number products as rectangular areas in mathematical reasoning."CCSS.Math.Content.3.MD.C.7c,Use tiling to show in a concrete case that the area of a rectangle with whole-number side lengths a and b + c is the sum of a ?? b and a ?? c. Use area models to represent the distributive property in mathematical reasoning.CCSS.Math.Content.3.MD.C.7d,"Recognize area as additive. Find areas of rectilinear figures by decomposing them into non-overlapping rectangles and adding the areas of the non-overlapping parts, applying this technique to solve real world problems."CCSS.Math.Content.3.MD.D,Geometric measurement: recognize perimeter as an attribute of plane figures and distinguish between linear and area measures.CCSS.Math.Content.3.MD.D.8,"Solve real world and mathematical problems involving perimeters of polygons, including finding the perimeter given the side lengths, finding an unknown side length, and exhibiting rectangles with the same perimeter and different areas or with the same are"CCSS.Math.Content.3.NBT.A,Use place value understanding and properties of operations to perform multi-digit arithmetic.CCSS.Math.Content.3.NBT.A.1,Use place value understanding to round whole numbers to the nearest 10 or 100.CCSS.Math.Content.3.NBT.A.2,"Fluently add and subtract within 1000 using strategies and algorithms based on place value, properties of operations, and/or the relationship between addition and subtraction."CCSS.Math.Content.3.NBT.A.3,"Multiply one-digit whole numbers by multiples of 10 in the range 10???90 (e.g., 9 ?? 80, 5 ?? 60) using strategies based on place value and properties of operations."CCSS.Math.Content.3.NF.A,Develop understanding of fractions as numbers.CCSS.Math.Content.3.NF.A.1,Understand a fraction 1/b as the quantity formed by 1 part when a whole is partitioned into b equal parts; understand a fraction a/b as the quantity formed by a parts of size 1/b.CCSS.Math.Content.3.NF.A.2,Understand a fraction as a number on the number line; represent fractions on a number line diagram.CCSS.Math.Content.3.NF.A.2a,Represent a fraction 1/b on a number line diagram by defining the interval from 0 to 1 as the whole and partitioning it into b equal parts. Recognize that each part has size 1/b and that the endpoint of the part based at 0 locates the number 1/b on the nuCCSS.Math.Content.3.NF.A.2b,Represent a fraction a/b on a number line diagram by marking off a lengths 1/b from 0. Recognize that the resulting interval has size a/b and that its endpoint locates the number a/b on the number line.CCSS.Math.Content.3.NF.A.3,"Explain equivalence of fractions in special cases, and compare fractions by reasoning about their size."CCSS.Math.Content.3.NF.A.3a,"Understand two fractions as equivalent (equal) if they are the same size, or the same point on a number line."CCSS.Math.Content.3.NF.A.3b,"Recognize and generate simple equivalent fractions, e.g., 1/2 = 2/4, 4/6 = 2/3). Explain why the fractions are equivalent, e.g., by using a visual fraction model."CCSS.Math.Content.3.NF.A.3c,"Express whole numbers as fractions, and recognize fractions that are equivalent to whole numbers."CCSS.Math.Content.3.NF.A.3d,"Compare two fractions with the same numerator or the same denominator by reasoning about their size. Recognize that comparisons are valid only when the two fractions refer to the same whole. Record the results of comparisons with the symbols &gt;, =, or &"CCSS.Math.Content.3.OA.A,Represent and solve problems involving multiplication and division.CCSS.Math.Content.3.OA.A.1,"Interpret products of whole numbers, e.g., interpret 5 ?? 7 as the total number of objects in 5 groups of 7 objects each."CCSS.Math.Content.3.OA.A.2,"Interpret whole-number quotients of whole numbers, e.g., interpret 56 ?? 8 as the number of objects in each share when 56 objects are partitioned equally into 8 shares, or as a number of shares when 56 objects are partitioned into equal shares of 8 object"CCSS.Math.Content.3.OA.A.3,"Use multiplication and division within 100 to solve word problems in situations involving equal groups, arrays, and measurement quantities, e.g., by using drawings and equations with a symbol for the unknown number to represent the problem."CCSS.Math.Content.3.OA.A.4,Determine the unknown whole number in a multiplication or division equation relating three whole numbers.CCSS.Math.Content.3.OA.B,Understand properties of multiplication and the relationship between multiplication and division.CCSS.Math.Content.3.OA.B.5,Apply properties of operations as strategies to multiply and divide.CCSS.Math.Content.3.OA.B.6,Understand division as an unknown-factor problem.CCSS.Math.Content.3.OA.C,Multiply and divide within 100.CCSS.Math.Content.3.OA.C.7,"Fluently multiply and divide within 100, using strategies such as the relationship between multiplication and division (e.g., knowing that 8 ?? 5 = 40, one knows 40 ?? 5 = 8) or properties of operations. By the end of Grade 3, know from memory all product"CCSS.Math.Content.3.OA.D,"Solve problems involving the four operations, and identify and explain patterns in arithmetic."CCSS.Math.Content.3.OA.D.8,Solve two-step word problems using the four operations. Represent these problems using equations with a letter standing for the unknown quantity. Assess the reasonableness of answers using mental computation and estimation strategies including rounding.CCSS.Math.Content.3.OA.D.9,"Identify arithmetic patterns (including patterns in the addition table or multiplication table), and explain them using properties of operations."CCSS.Math.Content.4.G.A,"Draw and identify lines and angles, and classify shapes by properties of their lines and angles."CCSS.Math.Content.4.G.A.1,"Draw points, lines, line segments, rays, angles (right, acute, obtuse), and perpendicular and parallel lines. Identify these in two-dimensional figures."CCSS.Math.Content.4.G.A.2,"Classify two-dimensional figures based on the presence or absence of parallel or perpendicular lines, or the presence or absence of angles of a specified size. Recognize right triangles as a category, and identify right triangles."CCSS.Math.Content.4.G.A.3,Recognize a line of symmetry for a two-dimensional figure as a line across the figure such that the figure can be folded along the line into matching parts. Identify line-symmetric figures and draw lines of symmetry.CCSS.Math.Content.4.MD.A,Solve problems involving measurement and conversion of measurements from a larger unit to a smaller unit.CCSS.Math.Content.4.MD.A.1,"Know relative sizes of measurement units within one system of units including km, m, cm; kg, g; lb, oz.; l, ml; hr, min, sec. Within a single system of measurement, express measurements in a larger unit in terms of a smaller unit. Record measurement equiv"CCSS.Math.Content.4.MD.A.2,"Use the four operations to solve word problems involving distances, intervals of time, liquid volumes, masses of objects, and money, including problems involving simple fractions or decimals, and problems that require expressing measurements given in a la"CCSS.Math.Content.4.MD.A.3,Apply the area and perimeter formulas for rectangles in real world and mathematical problems.CCSS.Math.Content.4.MD.B,Represent and interpret data.CCSS.Math.Content.4.MD.B.4,"Make a line plot to display a data set of measurements in fractions of a unit (1/2, 1/4, 1/8). Solve problems involving addition and subtraction of fractions by using information presented in line plots."CCSS.Math.Content.4.MD.C,Geometric measurement: understand concepts of angle and measure angles.CCSS.Math.Content.4.MD.C.5,"Recognize angles as geometric shapes that are formed wherever two rays share a common endpoint, and understand concepts of angle measurement:"CCSS.Math.Content.4.MD.C.5a,"An angle is measured with reference to a circle with its center at the common endpoint of the rays, by considering the fraction of the circular arc between the points where the two rays intersect the circle. An angle that turns through 1/360 of a circle i"CCSS.Math.Content.4.MD.C.5b,An angle that turns through n one-degree angles is said to have an angle measure of n degrees.CCSS.Math.Content.4.MD.C.6,Measure angles in whole-number degrees using a protractor. Sketch angles of specified measure.CCSS.Math.Content.4.MD.C.7,"Recognize angle measure as additive. When an angle is decomposed into non-overlapping parts, the angle measure of the whole is the sum of the angle measures of the parts. Solve addition and subtraction problems to find unknown angles on a diagram in real "CCSS.Math.Content.4.NBT.A,Generalize place value understanding for multi-digit whole numbers.CCSS.Math.Content.4.NBT.A.1,"Recognize that in a multi-digit whole number, a digit in one place represents ten times what it represents in the place to its right."CCSS.Math.Content.4.NBT.A.2,"Read and write multi-digit whole numbers using base-ten numerals, number names, and expanded form. Compare two multi-digit numbers based on meanings of the digits in each place, using &gt;, =, and &lt; symbols to record the results of comparisons."CCSS.Math.Content.4.NBT.A.3,Use place value understanding to round multi-digit whole numbers to any place.CCSS.Math.Content.4.NBT.B,Use place value understanding and properties of operations to perform multi-digit arithmetic.CCSS.Math.Content.4.NBT.B.4,Fluently add and subtract multi-digit whole numbers using the standard algorithm.CCSS.Math.Content.4.NBT.B.5,"Multiply a whole number of up to four digits by a one-digit whole number, and multiply two two-digit numbers, using strategies based on place value and the properties of operations. Illustrate and explain the calculation by using equations, rectangular ar"CCSS.Math.Content.4.NBT.B.6,"Find whole-number quotients and remainders with up to four-digit dividends and one-digit divisors, using strategies based on place value, the properties of operations, and/or the relationship between multiplication and division. Illustrate and explain the"CCSS.Math.Content.4.NF.A,Extend understanding of fraction equivalence and ordering.CCSS.Math.Content.4.NF.A.1,"Explain why a fraction a/b is equivalent to a fraction (n ?? a)/(n ?? b) by using visual fraction models, with attention to how the number and size of the parts differ even though the two fractions themselves are the same size. Use this principle to recog"CCSS.Math.Content.4.NF.A.2,"Compare two fractions with different numerators and different denominators, e.g., by creating common denominators or numerators, or by comparing to a benchmark fraction such as 1/2. Recognize that comparisons are valid only when the two fractions refer to"CCSS.Math.Content.4.NF.B,Build fractions from unit fractions by applying and extending previous understandings of operations on whole numbers.CCSS.Math.Content.4.NF.B.3,Understand a fraction a/b with a &gt; 1 as a sum of fractions 1/b.CCSS.Math.Content.4.NF.B.3a,Understand addition and subtraction of fractions as joining and separating parts referring to the same whole.CCSS.Math.Content.4.NF.B.3b,"Decompose a fraction into a sum of fractions with the same denominator in more than one way, recording each decomposition by an equation. Justify decompositions, e.g., by using a visual fraction model."CCSS.Math.Content.4.NF.B.3c,"Add and subtract mixed numbers with like denominators, e.g., by replacing each mixed number with an equivalent fraction, and/or by using properties of operations and the relationship between addition and subtraction."